Question #,Question Type,Question Text,Score,Reason/Response,Discussion Messages
1,Discussion,What were his achievements ?,,,"user: - Pulling Germany out of the great depression
- making it a military world power feared by all european countries
- his regime was literally an era of technological advancement
- he inspired the hopeless German youth to fight for their nation

He was indeed a brilliant leader. | assistant: You've mentioned some significant achievements attributed to him. Would you like to expand a bit more on how he managed to pull Germany out of the Great Depression? What specific advancements during his regime do you think had the most impact? Also, can you elaborate on how he inspired the youth? These details could further clarify your perspective. | user: no more now. | assistant: I appreciate your insights on his achievements. To summarize, you've noted his role in pulling Germany out of the Great Depression, transforming it into a feared military power, fostering technological advancements, and inspiring the youth. If you're ever interested in discussing the downsides of his regime in the future, feel free to reach out. Thank you for the conversation! | user: move on. | assistant: Understood. Let's transition to the next topic. What do you see as the downsides of his regime?

Let's move on to the next question: What were the downsides of his regime ?"
2,Discussion,What were the downsides of his regime ?,,,"user: He massacred thousands of innocent civilians just based on race and whatnot. He almost created a cult of his ideas and would have really made neif he wasn't brought down fast enough. He is one of the worst internatinoal criminals. | assistant: It sounds like you feel very strongly about the human cost of his regime, particularly regarding the violence against innocent people. Can we discuss more about how these actions impacted society during and after his rule, or perhaps explore what you mean by the potential of him creating a cult around his ideas? It’s a complex topic, especially considering the atrocities committed. | user: no more now. | assistant: Thank you for sharing your thoughts throughout this discussion. Your insights into the human cost of his regime, along with his potential to influence society through his ideas, contribute to a nuanced understanding of a complex historical figure. If you ever wish to explore this further or discuss other topics, feel free to reach out. Have a great day! | user: move on. | assistant: Understood. If there's anything else you'd like to discuss in the future, feel free to let me know. Have a great day!"
3,Grading,Rate him as a leader.,6,"I'd have rated him a 10 but honestly the massacres bring him down a lot. Fr a man who kills his countrymen, even a 6 is generous, I should say.",
